368, All Things Must Pass, George Harrison, 1970, Apple, "After the end of the Beatles, the Quiet One suddenly looked like the one best prepared for the solo life. After years of writing in the shadow of John Lennon and Paul McCartney, George Harrison had enough songs saved up to make his solo debut a triple album, featuring friends like Bob Dylan, Eric Clapton, and Ringo Starr. All Things Must Pass is full of spiritual guitar quests like “Isn’t It a Pity” and “My Sweet Lord,” the first Number One hit to include a Hare Krishna chant."
367, If You're Reading This It's Too Late, Drake, 2015, Cash Money, "Just when everyone was ready for more pop sensitivity from Drake, he went street. If You’re Reading This It’s Too Late was a mixtape for his rap base — no radio hits or catchy hooks, just his harshest beats and rhymes. It sums up Drake’s willingness to switch lanes at any moment. (Just a few months later, he swerved back into soft-soul territory on “Hotline Bling.”) He spends his money and curses his enemies in paranoid bangers like “10 Bands.”"
366, Rocks, Aerosmith, 1976, Columbia, "The bad boys from Boston perfected their Seventies guitar raunch on Rocks — it’s the musical equivalent of getting run over by a muscle car. Steven Tyler and Joe Perry sounded like America’s heirs to the Mick-and-Keith tradition with the filthy riffs of “Lick and a Promise” and “Back in the Saddle.” Tyler brings all his dirtbag swagger and gutter poetry to his favorite topic: sex. Surprise peak: “Sick as a Dog,” an incredible fusion of the Byrds, James Brown funk, and Sixties girl-group harmonies."
365, Madvillainy, Madvillain, 2004, Stones Throw, "This collaboration between rapper MF Doom and producer Madlib is one of underground hip-hop’s greatest moments. Madlib provides a shifting bed of warped funk and wildly unpredictable samples, drawing on everything from Thunder and Lightning’s “Bumpin’ Bus Stop” to “The Theme of the Justice League of America.” Doom’s rhymes are so casually adventurous that sometimes it takes a second to notice how stunning they are: “Still back in the game like Jack LaLanne/Think you know the name, don’t rack your brain/On a fast track to half sane” — hell yeah!"
364, More Songs About Buildings and Food, Talking Heads, 1978, Sire, "For their second record, Talking Heads found the ideal producer in Brian Eno: Their trilogy of albums with him made the band’s reputation. David Byrne splutters over the twitchy rhythms of “Artists Only” and “Thank You for Sending Me an Angel,” while crooning “The Big Country” as a ballad about feeling lost in America. The Heads cover Al Green’s “Take Me to the River,” a Memphis R&B hit just a year old at the time that they make feel like some kind of ancient prayer."
363, The Mothership Connection, Parliament, 1975, Casablanca, "George Clinton leads his Detroit crew of “extraterrestrial brothers” through a visionary album of science-fiction funk on jams like “Supergroovalisticprosifunkstication” and “Give Up the Funk (Tear the Roof Off the Sucker).” It’s a concept album inspired by Star Trek and 2001: A Space Odyssey, with Clinton as an outer-space radio DJ, broadcasting uncut funk from “the Chocolate Milky Way” and telling the people of Earth, “Put a glide in your stride and a dip in your hip, and come on up to the Mothership.”"
362, Never Too Much, Luther Vandross, 1981, Epic, "In the Seventies, Luther Vandross sang backup for Sister Sledge and Roberta Flack and co-wrote David Bowie’s “Fascination.” As a solo artist, he embodied sophisticated soul in the post-disco era. His debut LP shows off a dazzling range that came almost too easily — from the title track, one of the defining dance-funk hits of the Eighties, to his stunning rendition of the Burt Bacharach and Hal David classic “A House Is Not a Home,” which made the song uncoverable for future generations of singers."
361, The Black Parade, My Chemical Romance, 2006, Reprise, "Just as the Who did with Tommy, or Pink Floyd with The Wall, New Jersey act My Chemical Romance served up an era-defining rock opera, tailored for the golden age of emo. Frontman Gerard Way — the goth millennial answer to David Bowie — stars as a cancer patient who marches boldly into the afterlife (“The Black Parade”), where Liza Minelli, of all people, awaits him for a smashing horror-punk duet (“Mama”)."
360, One Nation Under a Groove, Funkadelic, 1978, Warner Bros., "George Clinton led two of the 1970s’ wildest bands: Funkadelic for rock guitars, Parliament for dance beats. But this album sums up his whole P-Funk empire, as Clinton spreads the gospel of mind-altering, loose-booty rhythms for the body and brain. “One Nation Under a Groove” is a call to arms, demanding “the funk, the whole funk, and nothing but the funk.” Another song asks, “Who Says a Funk Band Can’t Play Rock?!” It’s the same message Uncle Jam has always preached: Free your mind and your ass will follow."
359, Radio City, Big Star, 1974, Ardent, "Alex Chilton and his band of Memphis misfits were years ahead of their time — when they released Radio City in 1974, hardly anyone heard it. But like the Velvet Underground, they became hugely influential when future generations discovered them and got their minds blown. Big Star came up with their own skewed pop sound, filtering their love of the Beatles through their Memphis-soul roots. “September Gurls” and “Life Is White” should have been hits, soaring with the sweetly eccentric guitar chime and the romantic ache in Chilton’s voice."
358, Goo, Sonic Youth, 1990, Geffen, "With their sixth full album, the New York art-of-noise band made the leap from indie to major label, but few sold out so beautifully. From Thurston Moore and Lee Ranaldo’s frazzled guitar freakouts to Kim Gordon’s ghostly ode to Karen Carpenter, Goo retained all of Sonic Youth’s quirks and hallmarks. The sessions were technologically fraught, but they used those added production dollars to amp up their sonic assault. On tracks like “Kool Thing” and “Disappearer” they’d never sounded burlier — and yet more true to their alt-nation selves."
357, Rain Dogs, Tom Waits, 1985, Island, "“I like weird, ludicrous things,” Tom Waits once said. That understatement plays out most clearly on Rain Dogs, his finest portrait of the tragic kingdom of the streets. Self-producing his music for the first time and recording in his native Los Angeles, he went for a sound he described as “kind of an interaction between Appalachia and Nigeria.” Waits abandoned his signature grungy minimalism on the gorgeous “Downtown Train” (later a hit for Rod Stewart) and gets backing by Keith Richards on “Big Black Mariah.”"
356, Gris-Gris, Dr. John, 1968, Atco, "Mac Rebennack was a New Orleans piano player on songs for Professor Longhair and Frankie Ford who moved to L.A. in the Sixties, where he played on Phil Spector sessions and encountered California psychedelia. Rechristening himself Dr. John Creaux the Night Tripper, he made this swamp-funk classic. Gris-Gris blends New Orleans R&B, voodoo chants, and chemical inspiration. The groovy Afro-Caribbean percussion and creaky sound effects aren’t just otherworldly — they seem to come from several other worlds all at once."
355, Black Sabbath, Black Sabbath, 1970, Warner Bros., "Recorded in a single 12-hour blurt by a hippie-leaning former blues band, this lumbering debut conjures up a new, sludgy sound: the birth pains of heavy metal. The slide guitar on “Wizard” and the grungy boogie of “Wicked World” would influence not only future metal spawn but even the sound of Nirvana. The album’s most vivid nightmare is the six-minute “Black Sabbath,” which even scared the band itself. “We always wanted to go heavier than any other band,” said bassist Geezer Butler."
354, Germfree Adolescents, X-Ray Spex, 1978, EMI, "Teenage multiracial London girl Poly Styrene had braces on her teeth and wore Day-Glo rags, screeching anthems like “Oh Bondage! Up Yours!” over saxophone blasts, and chanting, “I am a poseur and I don’t care! I like to make people stare!” X-Ray Spex’s explosive punk-rock debut went criminally unreleased in the U.S., but it became a word-of-mouth cult classic throughout the indie-rock underground in the Eighties and Nineties, influencing Sleater-Kinney, the Beastie Boys, and many others."
353, The Cars, The Cars, 1978, Elektra, "“We used to joke that the first album should be called The Cars’ Greatest Hits,” said guitarist Elliot Easton. Their debut was arty and punchy enough to be part of Boston’s New Wave scene, and yet so catchy that nearly every track (“My Best Friend’s Girl,” “Just What I Needed”) landed on the radio. When Ric Ocasek died in 2019, Eason offered a fitting tribute: “If the goal was to have great success making pop music with a sense of irony, then mission accomplished, right?”"
352, The Slim Shady LP, Eminem, 1999, Interscope, "On which Eminem introduced himself as a crazy white geek, the “class-clown freshman/Dressed like Les Nessman.” Hip-hop had never heard anything like Em’s brain-damaged rhymes on this Dr. Dre-produced album, which earned Em respect, fortune, fame, and a lawsuit from his mom. Yet, while he claimed that God sent him here to piss off the world, his most endearing quality was that he saved his most unsparing rhymes for the worst villain in his messed-up life — not mom or his ex-wife, but himself."
351, For Your Pleasure, Roxy Music, 1973, Warner Bros., "Keyboardist Brian Eno’s last album with Roxy Music is the pop equivalent of Ultrasuede: highly stylish, abstract-leaning art rock. The collision of Eno’s and singer Bryan Ferry’s clashing visions gives Pleasure a wild, tense charm — especially on the driving “Editions of You” and “Do the Strand.” The album’s deeply weird centerpiece is “In Every Dream Home a Heartache”: Ferry sings a seductive ballad to an inflatable doll (“I blew up your body, but you blew my mind”), one of the creepiest love songs of all time."
350, Music of My Mind, Stevie Wonder, 1972, Tamla/Motown, "Recording after his onerous contract with Motown had expired, a newly empowered Stevie Wonder flexed his artistic control on Music of My Mind, making a relaxed, love-smitten warmup for blockbusters — like Innervisions and Songs in the Key of Life — to come, and playing nearly every funky note on classics such as “Love Having You Around” and “Superwoman (Where Were You When I Needed You).” Elsewhere, Wonder jammed on a Clavinet during the the tight boogie “Keep on Running” and on “Evil,” an openhearted intimacy with political overtones."
349, Kick Out the Jams, MC5, 1969, Elektra, "It’s the ultimate rock salute: “Kick out the jams, motherfuckers!” Recorded live in Detroit by Rob Tyner and his anarchist crew, Kick Out the Jams writhes and screams with the belief that rock & roll is a necessary act of civil disobedience. The proof: It was banned by a Michigan department store. The MC5 proved their lefty credentials the summer before the album was recorded when they were the only band that showed up to play for the Yippies protesting the 1968 Democratic Convention in Chicago."
348, Time (The Revelator), Gillian Welch, 2001, Acony, "Gillian Welch had a breakout moment when she appeared in the Coen brothers’ folk-music-themed movie O Brother, Where Art Thou?. She followed it with this striking modern-roots album, collaborating with guitarist David Rawlings on songs about love, sex, nostalgia, and the music of Elvis Presley. It ends with the 15-minute meditation “I Dream a Highway,” which the pair had never played before they recorded it, one example of the spontaneous power of an LP that made Depression-era music feel time-warped into the present."
347, Liquid Swords, GZA, 1995, Geffen, "The “Wu”-est of all of the Wu-Tang solo masterpieces, full of grimily cinematic production, winding crime narratives, mysticism, and mystery, not to mention copious kung fu-movie references and contributions from every Wu member. GZA delivers rhymes that are economical but devastating in their wisdom and narrative detail; “Bloodbaths in elevator shafts/Like these murderous rhymes tight from genuine craft,” he raps, summing up his style. Whatever strange alchemy the Staten Island guys came up with, Liquid Swords has it in utterly potent form."
346, AM, Arctic Monkeys, 2013, Domino, "Not many Brit-pop bands come up with strong second acts like this. The Arctic Monkeys debuted with the stun-gun pop punk of 2005’s Whatever People Say I Am, That’s What I’m Not. But by 2013, they’d moved to L.A. and, on AM, hit a sound that frontman Alex Turner likened to “the Spiders From Mars covering Aaliyah.” The results were not unlike David Bowie’s transformation on Station to Station — alluringly spooky, full of distressed falsetto soul, noir guitars, and rife with bar scenes that look like crime scenes with dead-end hookups."
345, "The Wild, the Innocent & the E Street Shuffle", Bruce Springsteen, 1973, Columbia, "Reeling from the commercial fizzle of his debut LP, Bruce Springsteen threw off the “new Dylan” baggage and applied his Jersey-bar-band skills to some of the funniest tunes he’d ever write: “Rosalita,” “Kitty’s Back,” and the boardwalk love song “4th of July, Asbury Park (Sandy).” The music is loose, jazzy, and full of ambition — a studio take on the live muscle that Springsteen was already famous for — and “New York City Serenade” is the first of Springsteen’s epic street operas."
344, Funky Kingston, Toots and the Maytals, 1973, Island, "Loose, funky, and exuberant, Kingston is the quintessential document of Jamaica’s greatest act after Bob Marley. Showcasing some of the Maytals’ best songs (“Pressure Drop,” later covered by the Clash) and borrowing from soul, pop, and gospel, Funky Kingston introduced the world to the great Toots Hibbert. He performs versions of “Louie Louie” and, in a down-home surprise, John Denver’s “Take Me Home, Country Roads,” with Toots changing the lyrics from “West Virginia” to “West Jamaica.”"
343, Greatest Hits, Sly and the Family Stone, 1970, Epic, "Sly and the Family Stone created a musical utopia: an interracial group of men and women who blended funk, rock, and positive vibes. Sly Stone, the Family mastermind, was one of the Sixties’ most ambitious artists, mixing up the hardest funk beats with hippie psychedelia on hits such as “Thank You (Falettinme Be Mice Elf Agin).” Greatest Hits ranges from gospel-style ballads (“Everybody Is a Star”) to rump shakers (“Everyday People”)."
342, Let It Be, The Beatles, 1970, Apple, "Let It Be is the sound of the world’s biggest pop group at war with itself. John Lennon is at his most acidic; George Harrison’s “I Me Mine” is about the sin of pride. Only Paul McCartney sounds focused, as if the title song were his personal survival mantra. The original concept was a live-in-the-studio album and film, begun in January 1969, that left the Beatles so weary that they abandoned the project to make Abbey Road. Phil Spector went back to the tapes later, sweetening ballads like “Across the Universe” and “The Long and Winding Road.”"
341, Siamese Dream, The Smashing Pumpkins, 1993, Virgin, "“All these alternative bands today are so high up on their punk-rock horse that they’re in denial about being huge and playing big shows,” Billy Corgan told Rolling Stone in 1994. “Not only do we respect the clichés, we see the truth in them.” On their second disc, the Pumpkins pushed further from Nineties alt-rock to a grander, orchestrated sound with multiple guitar parts, strings, and a Mellotron. Alt-rock ended up following the band on its trip: Siamese Dream is packed with hits (“Cherub Rock,” “Today”)."
340, Doggystyle, Snoop Doggy Dogg, 1993, Death Row/Interscope, "Until Snoop Dogg came along, no one in rap — and hardly anyone in rock — realized that an aloof whisper could be more intimidating than a shout. Snoop never gets heated; he takes the same tone when he’s menacing a cop as he does with a woman who’s soaping his back in the tub. Emanuel Dean and Dr. Dre’s sterling G-funk productions on “Gin N Juice” and “Who Am I (What’s My Name)?” ensured enormous album sales for the D-O-double-G’s debut and his laidbaaaack Indo-flavored tales of life on the streets of Compton."
339, Rhythm Nation 1814, Janet Jackson, 1989, A&M, "Janet Jackson bought a military suit and ruled the radio for two years with this album. Along with producers Jimmy Jam and Terry Lewis, she fashioned a grand pop statement with hip-hop funk (“Rhythm Nation”), slow jams (“Love Will Never Do [Without You]”), and even hair metal (“Black Cat”). “While writing ‘Rhythm Nation’ I was kidding around, saying, ‘God, you guys, I feel like this could be the national anthem for the Nineties,’” Jackson recalled. “Just by a crazy chance we decided to look up when Francis Scott Key wrote the national anthem, and it was September 14th, 1814.”"
338, Another Green World, Brian Eno, 19755, Island, "After years as a rock eccentric with Roxy Music and two groundbreaking solo LPs, Brian Eno was exploring new ideas about ambient music. But he said goodbye to song form with this album of pure synthetic beauty, mixing lush electronics (“Becalmed”) with acoustic instruments (“Everything Merges With the Night”) to cast a truly hypnotic spell. Eno’s work habits were pleasantly subversive too; at one impasse during the recording, he pulled out a cake from underneath the mixing console and served pieces to everyone in the studio."
337, John Wesley Harding, Bob Dylan, 1967, Columbia, "Recovering from his 1966 motorcycle crash, Bob Dylan made a left turn into country fables and stark mystic folkways. He took a quick trip to Nashville and banged out John Wesley Harding. It’s his most ominous album, with characters from the Bible and the shadowy side of American history, from “I Am a Lonesome Hobo” to “All Along the Watchtower.” With his stripped-down sound and a black-and-white cover photo, Dylan was defiantly rejecting all the current trends — going his own way, as usual."
336, Avalon, Roxy Music, 1982, E.G./Warner Bros., "Peter Sinfield, the producer of Roxy Music’s angular and wild 1972 debut, said that on Avalon they “ran out of naiveté.” Their sound was now woozy and refined, horny yet mature, and unabashedly, unironically romantic. A synth-soul landmark, Avalon was their biggest hit, their swan song, and the height of rock elegance and sophistication. The reggae lilt of the album’s title track was inspired by Bob Marley, who had recorded at the same studio as Roxy Music during the Seventies."
335, The Basement Tapes, Bob Dylan and the Band, 1975, Columbia, "Bob Dylan and his pals spent the Summer of Love in Woodstock, messing around in the basement of a house they called Big Pink. The songs were so deeply weird, they sat unreleased for years, until The Basement Tapes finally collected bootleg favorites like “Million Dollar Bash” and “You Ain’t Going Nowhere.” (For a deeper dive, see the 2014 box set.) “They were a kick to do,” Dylan told Rolling Stone’s Jann S. Wenner in 1969. “That’s really the way to do a recording — in a peaceful, relaxed setting — in somebody’s basement. With the windows open … and a dog lying on the floor.”"
334, Abraxas, Santana, 1970, Columbia, "“Black Magic Woman,” the Top Five hit from Abraxas, is definitive Santana: Afro-Latin grooves and piercing, lyrical, psychedelic blues guitar. It’s a cover of a Fleetwood Mac song written by one of Carlos Santana’s guitar heroes, Peter Green. The album’s other hit was also a cover: Tito Puente’s “Oye Como Va.” The clarion quality of Santana’s solos inspired many guitarists, especially artists looking to bridge seemingly divergent styles, including Prince."
333, Still Bill, Bill Withers, 1972, Sussex, "“Too many black artists get conned into doing so-called standards,” Withers said in 1972. “Songs by white writers who make the big money.” On his second album, Withers simply decided to write his own standards. The friendship anthem “Lean on Me” became his signature, while the propulsive “Use Me” would become one of the most-beloved tunes of all time, later sung by D’Angelo, Fiona Apple, and many others. If Just As I Am introduced Withers as a vital voice, Still Bill solidified him as a songwriter’s songwriter."
332, Elvis Presley, Elvis Presley, 1956, RCA, "In November 1955, RCA Records bought Elvis Presley’s contract, singles, and unreleased master tapes from Sun Records for $35,000. His first full-length album came out four months later, with tracks drawn from both the Sun sessions and from further recording at RCA’s studios in New York and Nashville. “There wasn’t any pressure,” guitarist Scotty Moore said. “They were just bigger studios with different equipment.” On tracks such as “Blue Suede Shoes,” that meant revved-up country music with the sexiest voice anyone had ever heard."
331, Like a Prayer, Madonna, 1989, Sire, "“I like the challenge of merging art and commerce,” Madonna told Rolling Stone. After dominating Eighties pop without always getting the critical respect she deserved, Madonna finally won artistic recognition with her most personal set of songs, including “Till Death Do Us Part” and “Oh Father.” And she nailed the commerce side with “Express Yourself” and the title track, the video of which had the Vatican talking about blasphemy. “I pray when I’m in trouble or when I’m happy,” she said. “When I feel any sort of extreme.” Like a Prayer fused all of her extremes brilliantly."
330, Aftermath, The Rolling Stones, 1966, London, "The Stones sound mean and jaded on Aftermath, writing bad-boy songs about Swinging London’s overnight stars, groupies, hustlers, and parasites. This is the first Stones album completely written by Mick Jagger and Keith Richards, a collection of tough riffs (“It’s Not Easy”) and tougher acoustic blues (“High and Dry”); of girls seeking kicks (“Under My Thumb”) or just escape (“Think”), of zooming psychedelia (“Paint It, Black”), baroque-folk gallantry (“I Am Waiting”), and an epic groove (the 11-minute “Going Home”)."
329, Endtroducing....., DJ Shadow, 1996, Mo’ Wax, "Northern California beat junkie Josh Davis (a.k.a. DJ Shadow) spent a year and a half chasing his dream of “the ultimate sample record,” and nailed it with his debut LP. Endtroducing….. is the height of the mid-Nineties trend of the hip-hop DJ as an experimental sound painter, a mix of head-trip beats, absurdist samples, and old-school block-party showmanship that touched listeners way beyond the turntablist underground. “Endtroducing was a big influence on OK Computer,” Jonny Greenwood of Radiohead recalled."
328, Modern Vampires of the City, Vampire Weekend, 2013, XL, "On Halloween 2012, with their hometown New York subsumed in a blackout, Vampire Weekend went on late-night TV to play an atheist reggae jam called “Unbelievers” dressed as skeletons. It was the perfect introduction to Modern Vampires of the City, a record that darkened their buoyant indie pop, as Ezra Koenig sang about moving beyond his post-college years into something scarier and weirder — hitting a cloudy peak with the beautifully worried Dylanesque travelogue “Hannah Hunt.”"
327, Live at Leeds, The Who, 1970, Decca, "Faced with the impossible task of following up the grand statement of Tommy [see No. 190], the Who just cranked up their amps. Rather than wade through 80 hours of American shows for a live album, Pete Townshend claimed he burned those tapes “in a huge bonfire” and selected a concert at the University of Leeds in England. Live at Leeds is a warts-and-all live album, including an accidental clunking sound on “My Generation.” There’s no finesse, just the pure power of a band able to play as loud as it wants to."
326, Dirty Mind, Prince, 1980, Warner Bros., "A mix of slinky funk, synth-driven rock, jittery pop, and sexual innuendo, Dirty Mind was Prince’s first great album, even if it only hinted at where he was headed. “White, black, Puerto Rican, everybody just a freakin’,” he sang on “Uptown,” a utopian ode to the Minneapolis club scene. The album includes the world’s merriest done-me-wrong song, “When You Were Mine,” and the incest ditty “Sister.” “I wasn’t being deliberately provocative,” Prince said. “I was being deliberately me.”"
325, All Killer No Filler!, Jerry Lee Lewis, 1993, Rhino, "Jerry Lee Lewis is best known for his frenzied piano-pumping Sun classics like “Great Balls of Fire” and “Whole Lotta Shakin’ Goin’ On,” cut in the late Fifties (before he derailed his success by marrying his 13-year-old cousin), yet his career as a country hitmaker lasted decades. Listen to “What’s Made Milwaukee Famous (Has Made a Loser Out of Me)” and you might agree with the Killer’s characteristically self-deprecating claim that “Elvis was the greatest, but I’m the best.”"
