235, Metallica (The Black Album), Metallica, 1991, Elektra, "After a decade of breaking metal’s speed limits, Metallica pared down their sound to the bare bones for their self-titled “Black Album.” “Enter Sandman” became a blockbuster because listeners finally had the space to sing along with James Hetfield’s bleak visions. Metallica achieved maximum heaviness on “Sad but True” by letting their guitars ring out for once; they embraced cinematic melodrama on “The Unforgiven” and “Wherever I May Roam,” and showed unusual depth for a band named Metallica with the sincere, no-bullshit ballad “Nothing Else Matters.”"
234, Master of Reality, Black Sabbath, 1971, Veritgo, "Paranoid may have bigger hits, but Master of Reality, released a mere six months later, is heavier. It was the band’s first attempt to use the recording studio, and it’s full of ambitious ideas (check out Bill Ward’s funky timbale work on “Children of the Grave”). The highlight is “Sweet Leaf,” a droning love song to marijuana. The vibe is perfectly summed up by the final track, “Into the Void.” But it isn’t all relentless doom: “After Forever,” written by bassist Geezer Butler, pretty much invents the idea of Christian metal."
233, Little Earthquakes, Tori Amos, 1992, Atlantic, "Here Tori Amos established herself as the poet laureate for a generation of battle-worn young women no longer satisfied with silence. From behind a piano that she wields like a machete aside her sharp, poignant reflections, Little Earthquakes is an incisive reflection on sexual assault, abuse, PTSD, and coming of age under the heavy veil of it all. At times thorny and confrontational, Amos’ voice still remains a warm invitation to people, like her, learning how to diffuse their trauma and move forward as best they can."
232, Giant Steps, John Coltrane, 1960, Atlantic, "With characteristic humility, John Coltrane said the title of this album referred to the loping instrumental gait of his bassist Paul Chambers. On his Atlantic debut, Coltrane played with a heated melodic enthusiasm — flying clusters of notes — that declared new possibilities for jazz improvisation and predicted the ferocious, harmonically open lyricism that would come with his mid-Sixties records on Impulse. “Mr. P.C.,” “Cousin Mary,” and “Spiral” became Coltrane’s first classics."
231, Damn the Torpedoes, Tom Petty and the Heartbreakers, 1979, Backstreet, "With hair like Jagger’s and a voice like Dylan’s in tune, Tom Petty and his bar band defrilled classic rock: In 1979, he filed for bankruptcy; then Torpedoes took off, mostly because “Here Comes My Girl” seemed to keep the promises those like Jagger et al., forgot they’d made. Perfectly produced by future music-industry megamogul Jimmy Iovine, Torpedoes gave bright jangling Sixties rock a sheen that made pretty much everything else on AOR radio seem lumpy and stiff, while Petty’s obvious authenticity kept the music from ever seeming calculated or overly polished."
230, Anti, Rihanna, 2016, Roc Nation, "After dominating the Top 40 for years, Rihanna wanted to make an ambitious album-statement, brilliantly sustaining the tipsy two-in-the-morning vibe of this moody midcareer reinvention. “I just gravitated toward the songs that were … the things I want to listen to,” she said. “The things that I want to smoke to.” On Anti, she recast pop as her own hazy playground, referencing Dido and hair metal, covering Tame Impala, and merging dancehall and torch ballads."
229, The Ultimate Collection, Patsy Cline, 2000, Universal, "Her career was cut short when she died in a plane crash at 30, but Patsy Cline made her mark as one of country’s great singers. “Even though her style is considered country, her delivery is more like a classic pop singer,” Lucinda Williams has noted. Her hits “Walkin’ After Midnight” and “I Fall to Pieces” also made it to the pop charts, establishing the template for country crossover that pointed the way forward for generations; her version of “Crazy” was a godsend to the song’s struggling writer, a young Willie Nelson."
228, De La Soul Is Dead, De La Soul, 1991, Tommy Boy, "The cover of De La Soul’s second album — an overturned flowerpot of dead daisies — was as subtle as a sledgehammer. After the sunny 3 Feet High and Rising, the confrontationally pessismsitic De La Soul Is Dead was a shock; songs dealt with sexual assault (“Millie Pulled a Pistol on Santa”) and drug abuse (“My Brother’s a Basehead,” based on member Posdnuos’ brother’s crack addiction). But the fun wasn’t totally over (see “A Roller Skating Jam Named ‘Saturdays’”) and producer Prince Paul gave the dense LP a sample-delic flow."
227, Here’s Little Richard, Little Richard, 1957, Specialty, "“I came from a family where my people didn’t like rhythm and blues,” Little Richard told Rolling Stone in 1970. “Bing Crosby, ‘Pennies From Heaven,’ Ella Fitzgerald was all I heard. And I knew there was something that could be louder than that, but didn’t know where to find it. And I found it was me.” Richard’s raucous debut collected singles such as “Good Golly, Miss Molly,” in which his rollicking boogie-woogie piano and falsetto scream ignited the unfettered possibilities of rock & roll."
226, Layla and Other Assorted Love Songs, Derek and the Dominos, 1970, Atco, "Eric Clapton was tired of stardom, so he formed a new band where he could be just another one of the lads. But there was no mistaking the blues guitar on “Layla,” as Clapton sang about falling in love with the wife of his best friend, George Harrison. The tortured love songs on Layla get a kick from guest Duane Allman, whose interplay with Clapton in “Key to the Highway” and “Have You Ever Loved a Woman” is both harmonious and fiercely competitive: electric, brotherly love."
225, Yankee Hotel Foxtrot, Wilco, 2001, Nonesuch, "When Reprise Records refused to release Yankee Hotel Foxtrot, Wilco posted it for free on the internet. Two-hundred-thousand downloads later, Nonesuch Records (owned by the same company as Reprise) released the album, and it became critical and commercial gold. Its pretty acoustic-guitar melodies battled noise, skidded into dissonance, or got chopped off abruptly. Its lyrics pitted hope against doubt, with all bets off. “You have to learn how to die,” crooned Jeff Tweedy, “if you wanna … be alive.”"
224, Fly, Dixie Chicks, 1999, Monument, "Before their criticism of George W. Bush made them Nashville exiles and before they established their legacy as country’s most righteous troublemakers, the Chicks were effortlessly ruffling feathers on their infectious, poppy fifth album, Fly. “Cowboy Take Me Away,” “Ready to Run,” and “Goodbye Earl” became defining country hits of the late Nineties, but the rest of the record was hardly filler, from the intense balladry of “Cold Day in July” to the thrash-metal-with-fiddles freakout of “Sin Wagon.”"
223, Imagine, John Lennon, 1971, Apple, "After the primal-scream therapy of Plastic Ono Band [see No. 85], Lennon softened up on his second solo album. There is still the stinging “Gimme Some Truth” and his evisceration of Paul McCartney, “How Do You Sleep?” — both featuring George Harrison on guitar. But there is also the aching soul of “Jealous Guy” and the irresistible “Oh Yoko!” Imagine is self-consciously luminescent, pointedly embraceable. Lennon said of the title track: “Now I understand what you have to do. Put your political message across with a little honey.”"
222, Ray of Light, Madonna, 1998, Maverick, "For her first post-motherhood disc, Madonna and producer William Orbit showed the world that electronica didn’t have to be cold. Songs like the title track and “Nothing Really Matters” are beat-driven but restrained — filled with warmth and wonder. Ray also features Madonna’s best singing ever. “A ray of light to me is hope,” she said, describing her inspiration in making the album. “We are zooming forward, but that doesn’t mean you can lose touch with the spiritual side of things.”"
221, Rage Against the Machine, Rage Against the Machine, 1992, Epic, "“I believe in this band’s ability to bridge the gap between entertainment and activism,” declared Zack de la Rocha, whose radical politics found sympathetic muscle in Tom Morello’s howling one-guitar army, making a furor unheard since the MC5 and Clash. “Killing in the Name” took on historical racism within U.S. policing, a message that remains sadly prescient, and songs like “Bombtrack” and “Wake Up” were funky fusillades that proved rap rock could change minds as well as roil arena mosh pits."
220, Déjà Vu, "Crosby, Stills, Nash, and Young", 1970, Epic, "Neil Young was just getting his solo career underway when he joined his old Buffalo Springfield bandmate Stephen Stills, ex-Byrd David Crosby, and former Hollie Graham Nash in the first of the West Coast supergroups. Young’s vision and guitar transformed the earlier folk-rock CSN into a rock & roll powerhouse. The CSNY combination was too volatile to last, but on their best album, they offered pop idealism (Nash’s “Teach Your Children”), militant blues (Crosby’s “Almost Cut My Hair”), and vocal-choir gallop (Stills’ “Carry On”)."
219, Only Built 4 Cuban Linx, Raekwon, 1995, Loud/RCA, "The finest Wu-Tang solo joint stands out due to Raekwon’s understated, eternally unflustered cool and densely woven verses. Abetted by hyperactive sideman Ghostface and hypnotically stark beats courtesy of the RZA, Raekwon crafts breathtaking drug-rap narratives. On “Knowledge God,” an Italian drug dealer with a “hairy chest” and “many minks” meets his colorful demise in just six words: “Sixteen shots in his fish tank.” It’s the rare hip-hop album that rivals the mob movies it celebrates for gripping detail."
218, CrazySexyCool, TLC, 1994, LaFace, "Things were not well with TLC during the making of CrazySexyCool: Lisa “Left Eye” Lopes was lighting fires, and the group was in a financial slide that would end in bankruptcy proceedings. But they emerged with the most effervescent and soulful R&B pop anyone had heard since the Supremes. “Creep” is hard-edged but cute, the summery “Diggin’ on You” is almost pastoral in its intimate flow, and the transcendent “Waterfalls” may be the greatest song ever about how it’s not a great idea to go after your dreams."
217, Definitely Maybe, Oasis, 1994, Epic, "Oasis didn’t get the memo about how Nineties rockers had to be all angst-y and fame-hating, but the Gallagher brothers’ cockiness would have been hollow without the supersonic songs on their debut. Liam’s insolent snarl and his brother Noel’s dialed-to-11 guitar on working-class anthems like the elevating “Live Forever” and the blaring “Rock ‘n’ Roll Star” built off the Beatles and T. Rex to reach for their own glorious future."
216, Either/Or, Elliott Smith, 1997, Kill Rock Stars, "Elliott Smith had ambitions to make records with a Beatlesque sound — but zero interest in Beatlesque fame — when he recorded Either/Or. While he achieved his dreams on several subsequent major-label releases, the Portland, Oregon, indie-folk singer-songwriter’s third album resonates because of his low-fi whisper and gritty, sepia-toned lyrics. His songs struck a nerve well beyond the Northwest music scene — Madonna, of all people, covered the morosely pretty drunk’s lullaby “Between the Bars.”"
215, American Beauty, Grateful Dead, 1970, Warner Bros., "The Dead never sounded better in the studio than in the down-home stoner country of American Beauty. Released just five months after the folkie classic Workingmans Dead, American Beauty has some of their most beloved songs in “Ripple,” “Brokedown Palace,” and “Truckin’.” Jerry Garcia and Robert Hunter were on a hot streak, writing the ultimate outlaw credo in “Friend of the Devil.” “Box of Rain” has the Dead’s most emotional harmony vocals, especially in the haunting final lines: “Such a long, long time to be gone/And a short time to be there.”"
214, Wildflowers, Tom Petty, 1994, Warner Bros., "Petty struggled for two years to make the Rick Rubin-produced follow-up to 1989’s hit Full Moon Fever. He left tons of songs in the can, and the final product stretched to 70 minutes but didn’t have any filler. Petty hit a new songwriting peak, going from intimate, soul-bearing songs like the title track and “Crawling Back to You” to rockers like “You Wreck Me” and “House in the Woods.” “I think it’s maybe my favorite LP that I’ve ever done,” Petty said."
213, The Idler Wheel, Fiona Apple, 2012, Epic, "The Idler Wheel continued Fiona Apple’s run as one of modern pop’s most thrilling eccentrics. There’s a single-minded intensity to songs like “Every Single Night” and “Hot Knife,” where she puts an almost shocking amount of feeling into each syllable. Apple can sound like a cabaret singer in one song and a blueswoman in the next, her voice full of sandpaper edges and bestial roars. “I may need a chaperone,” she wonders on “Daredevil,” but this album proves she’s at her very best when left to her own devices."
212, Wild Is the Wind, Nina Simone, 1966, Philips, "Aretha was the Queen of Soul, but Nina Simone, as one of her album titles proclaimed, was its high priestess, and this 1966 LP is among her most enthralling and eclectic. With her dusky voice at its most commanding, Simone works her way through roadhouse soul (“I Love Your Lovin’ Ways”) and dramatic set pieces (the melancholic “Lilac Wine,” later covered by Jeff Buckley). It peaks with “Four Women,” an ambitious saga of racially diverse women and their struggles, written by Simone."
211, Unknown Pleasures, Joy Divison, 1980, Factory, "Joy Division came from the northern England industrial gloom of Manchester, four blue-collar lads chasing a new kind of goth-punk grandeur. Right from the opening, “Disorder,” Unknown Pleasures sounds like nothing else, with the doomed Ian Curtis yelping his dark poetry (“I got the spirit!”) over Peter Hook’s bass pulse. But for all the despair, there’s something inspiring in the surge of “Interzone” and “New Dawn Fades.” Black-clad young bands have been imitating Joy Division ever since."
210, The Birth of Soul, Ray Charles, 1991, Atlantic, "Ray Charles was just about the first person to perfect that mix of blues and gospel, holy and filthy, that we know as soul music. He was knocking around Seattle when Atlantic bought out his contract in 1952. For the next eight years, he turned out brilliant singles such as “What’d I Say” and “I Got a Woman.” This box collects every R&B side he cut for Atlantic, though his swinging take on “My Bonnie” will have you thinking it covers his Atlantic jazz output as well."
209, Raising Hell, Run-DMC, 1986, Profile, "Working for the first time with producer Rick Rubin, the Hollis, Queens, crew of Run, DMC, and Jam Master Jay made an album so undeniable, it forced the mainstream to cross over to hip-hop. “Peter Piper” kicked the rhymes over a jingling cowbell sampled from an old jazz-fusion record. On “My Adidas,” “It’s Tricky,” and “You Be Illin’,” Run and DMC talked trash while the DJ made their day. They even hit MTV with a vandalistic remake of Aerosmith’s “Walk This Way,” featuring Steven Tyler and Joe Perry."
208, Tha Carter III, Lil Wayne, 2008, Cash Money/Universal Motown, "By 2008, Lil Wayne contained multitudes: Best Rapper Alive, Pussy Monster, Martian, Weezy F. Baby (and the “F” is for, well, pretty much any word starting with “F”). Tha Carter III was a monument to this multiple-personality menagerie. “A Milli,” a glorified freestyle, fully crossed over to the mainstream, while “Lollipop,” a robotic R&B jam, rightly bet that an audience was ready to invest in Wayne’s croaky, syrup-addled singing voice. More than a decade later, even Wayne’s most outré personalities are still birthing musical descendants."
207, Eagles, Eagles, 1972, Asylum, "This debut created a new template for laid-back L.A. country-rock style. Behind the band’s mellow message — “Take It Easy,” “Peaceful Easy Feeling” — was a relentless drive. “Everybody had to look good, sing good, play good, and write good,” Glenn Frey told Cameron Crowe in Rolling Stone. Beyond the album’s three hit singles, songs like the somber waltz “Most of Us Are Sad,” the pickin’ and grinnin’ “Earlybird,” and the down-home rocker “Nightingale” showed a band that had perfected a sound right out of the gate."
206, Low, David Bowie, 1977, RCA, "David Bowie fled to Berlin to kick cocaine — not to mention his other drug of choice, stardom. He moved into a flat above a hardware store and restarted his music from scratch, teaming up with Brian Eno and producer Tony Visconti. Low was split between electronic instrumentals and quirky funk like “Sound and Vision.” It began his famous “Berlin trilogy” — though it was cut mostly in France — topped off by Heroes and Lodger. In 1977, Bowie also produced Iggy Pop’s two finest solo albums, The Idiot and Lust for Life."
205, Tea for the Tillerman, Cat Stevens, 1970, A&M, "With its chamber-pop arrangements, Tea for the Tillerman is one of the British folkie’s most ambitious albums (to take one example of Cat Stevens’ thinking at the time, the LP’s gentle, advice-dispensing “Father and Son” began as a song for a musical he wanted to write about the Russian Revolution). It soothed countless living rooms in the Seventies, but the album is deceptively angst-y. Both the hit single “Wild World” and the bleak ballad “Hard-Headed Woman” find him condemning his ex Patti D’Arbanville — who later shacked up with Mick Jagger."
204, Graduation, Kanye West, 2007, Roc-A-Fella, "“I’m doin’ pretty good as far as geniuses go,” Kanye West rapped on Graduation’s “Barry Bonds.” At the time, no one could argue with that. For his third album, West pared down the ornate production for a new kind of sleek stadium rap, deftly expanding his sampling palette to include Steely Dan, Daft Punk, and even Krautrockers Can, while giving his fame-sucks brags and gripes an introspect that points toward emo rap."
203, Pink Moon, Nick Drake, 1979, Island, "Nick Drake recorded his last album in a couple of nights, mailed the tapes to Island Records, and checked himself into a psychiatric ward. If the music were as dark as the lyrics, it might be unlistenable. But Drake’s soothing vocals and unadorned acoustic picking unfold with supernatural tenderness. Few heard Pink Moon when it was released, but its stark beauty has touched the intimate bedroom folk of Cat Power, Elliott Smith, and many others."
202, Homogenic, Björk, 1997, Elektra, "Björk’s third album was a departure from the fun, playful electronics of her mid-Nineties solo sets Debut and Post, adopting a more uniform, chilly, and distinctly Icelandic sound in its fusion of trip-hop with neo-classical strings. “Jóga,” with its stratosphere-high vocals and beats inspired by volcanic eruptions, may be Björk’s signature song, but it’s only one sample of the album’s palette, jagged and luminescent like broken stained glass. The sheer beauty underneath its boldness and abrasion has enraptured countless artists, from Thom Yorke to Arca, in the years since its release."
201, Midnight Marauders, A Tribe Called Quest, 1993, Jive, "Tribe had a lot to live up to on the follow-up to The Low End Theory, but they kept the boho rap groove going. Q-Tip and co-producer Ali Shaheed Muhammad layered the LP with vintage jazz samples and intentionally doubled-up drums to retain the spirit of New York boom-bap, as Q-Tip and Phife Dawg deepened their rhymes on tracks like “Electric Relaxation.” In a historic moment of New York hip-hop synergy, Midnight Marauders was released the same day as the Wu-Tang Clan’s Enter the Wu-Tang."
200, Diamond Life, Sade, 1984, Epic, "Nigerian-born fashion designer Sade Adu and her London band defined elegantly cool Eighties soul with their smash debut, Diamond Life. Torch ballads like “Smooth Operator” and “Your Love Is King” had a New Romantic opulence under the bittersweet pang of Adu’s voice. She wrote her first song, “When Am I Going to Make a Living,” on the back of a bill, while walking home in the rain from a bus stop after work. As she said, “All the songs I’ve ever loved — even jazz stuff — are things that tell a story.”"
199, Slanted and Enchanted, Pavement, 1993, Matador, "Pavement were the quintessential American independent rock band, and this is the quintessential indie-rock album. The playing is loose-limbed, the production laid-back and primitive, the lyrics quirky and playful, the melodies sweet and seductive. But the sound is as intense as the white noise of the Velvet Underground, even as songs like “Summer Babe” reflect singer-guitarist Stephen Malkmus’ love of Seventies AM pop. Slanted and Enchanted is one of the most influential rock albums of the 1990s; its fuzzy recording style can be heard in the music of Nirvana, Liz Phair, Beck, the Strokes, and the White Stripes."
198, The B-52's, The B-52's, 1979, Warner Bros., "The debut by the B-52’s sounds like a bunch of high school friends cramming all their running jokes, goofy sounds, and private nicknames into a New Wave record. “We never thought it would get past our circle of friends in Athens [Georgia],” vocalist Fred Schneider told Rolling Stone. It turned out that nobody could resist the band’s campy, arty funk, or the eccentric squeals and bouffant hairdos of Kate Pierson and Cindy Wilson. (Playing organ, Pierson also defined the band’s sound.) They played toy instruments, and their thrift-store image was as inventive and colorful as their music — which, with “Rock Lobster,” was pretty inventive and colorful."
197, Meet the Beatles!, The Beatles, 1964, Capitol, "For Americans in the full grip of Beatlemania, this was the first album they could buy. Meet took the Fabs’ second British record, With the Beatles, dropped five covers, and added three tracks, including the singles “I Want to Hold Your Hand” and “I Saw Her Standing There.” (This arguably made a hash of the Beatles’ artistic intentions, yet made for a much better record.) John Lennon and Paul McCartney were on a roll that would be unmatched in rock history, and at this point they were a real team. They wrote “I Want to Hold Your Hand” together — on a piano in the basement of the home of Jane Asher, McCartney’s actress girlfriend — as Lennon put it, “eyeball to eyeball.”"
196, Body Talk, Robyn, 2010, Konichiwa, "Robyn had a few Swedish teen-pop hits in the Nineties, but she’s a worldly adult on Body Talk — this was the voice of a woman who knew how it felt to shed tears on the dance floor. She released Body Talk in three mini-album installments on her own Konichiwa label, before cherry-picking the highlights for this epochal feminist disco statement. “Dancing on My Own” became this century’s answer to “I Will Survive.” She told Rolling Stone, “I was pushing through the challenges and getting off on that liberated feeling of being able to explore desperation and passion and frustration and all that.”"
195, Songs of Leonard Cohen, Leonard Cohen, 1967, Columbia, "Leonard Cohen was already well into his thirties when he made his debut, in the Summer of Love. The Montreal poet had been publishing his books to literary acclaim for years, but he took to songwriting, with his acoustic guitar and the orchestrations of producer John Simon. These were the late-night ballads that made his legend, starting with “Suzanne” and “Sisters of Mercy.” But Cohen specialized in farewells, blowing kisses to his muses in “So Long, Marianne” and “Hey, That’s No Way to Say Goodbye.” He kept writing brilliant songs into his eighties, right up to his death in 2016."
194, Bad, Michael Jackson, 1987, Epic, "After Thriller turned Michael Jackson into an international pop phenomenon, he spent two years of work on the follow-up. The title song came with a 17-minute video by Martin Scorsese that cost $2 million. Bad gave Jackson more hits to add to his collection: “I Just Can’t Stop Loving You,” “Bad,” “The Way You Make Me Feel,” and “Man in the Mirror.” He also began to vent some of his darker emotions on “Smooth Criminal” and the paranoid “Dirty Diana.” Not long afterward, Jackson would retreat to his Neverland ranch."
193, Willy and the Poor Boys, Creedence Clearwater Revival, 1969, Fantasy, "Sharp social criticism (“Fortunate Son”) and party music (“Down on the Corner”) take a ride on the Creedence bandwagon. John Fogerty’s ability to wed swamp rock with catchy, complex arrangements gave Willy a durability few rock albums can match. “It Came Out of the Sky” told the story of a farm boy who finds a space ship in his backyard, with cameos by Spiro Agnew and Ronald Reagan, and the album climaxes with “Effigy,” an inferno image of apocalypse across the land that’ll leave you breathless, especially when you remember you’re listening to the biggest Top 40 band in America at the time."
